{
  "request_status": "clarify",
  "evidence_status": "sufficient",
  "missing_conditions": [
    {
      "code": "selection_rule",
      "detail": "사용자에게 selection_rule 조건 확인이 필요합니다.",
      "evidence": [
        {
          "evidence_id": "message/answer-1",
          "quote": "좀 더 큰 거래만 골라줘."
        }
      ]
    }
  ],
  "unsupported_actions": [],
  "draft_verdict": "fail",
  "reflection_verdict": "fail",
  "evidence": [
    {
      "evidence_id": "message/answer-1",
      "quote": "좀 더 큰 거래만 골라줘."
    }
  ],
  "issues": [
    {
      "code": "reflection_mismatch",
      "detail": "요청·답변의 조건과 초안이 다릅니다.",
      "path": "/workflow/nodes/1/settings/execution_plan/filters/0/value",
      "expected": "미확정",
      "actual": "2000000",
      "evidence": [
        {
          "evidence_id": "message/answer-1",
          "quote": "좀 더 큰 거래만 골라줘."
        }
      ]
    }
  ],
  "summary": "정답 정책에 따라 상태와 초안 조건을 구분했습니다."
}