{
  "request_status": "ready",
  "evidence_status": "sufficient",
  "missing_conditions": [],
  "unsupported_actions": [],
  "draft_verdict": "pass",
  "reflection_verdict": "pass",
  "evidence": [
    {
      "evidence_id": "message/answer-1",
      "quote": "보증금 기준으로 200만원 초과만 골라줘."
    }
  ],
  "issues": [],
  "summary": "정답 정책에 따라 상태와 초안 조건을 구분했습니다."
}