{
  "request_status": "ready",
  "evidence_status": "sufficient",
  "missing_conditions": [],
  "unsupported_actions": [],
  "draft_verdict": "fail",
  "reflection_verdict": "fail",
  "evidence": [
    {
      "evidence_id": "message/answer-1",
      "quote": "보증금 기준으로 200만원 초과만 골라줘."
    }
  ],
  "issues": [
    {
      "code": "reflection_mismatch",
      "detail": "요청·답변의 조건과 초안이 다릅니다.",
      "path": "/workflow/nodes/1/settings/execution_plan/filters/0/field",
      "expected": "보증금",
      "actual": "임대료",
      "evidence": [
        {
          "evidence_id": "message/answer-1",
          "quote": "보증금 기준으로 200만원 초과만 골라줘."
        }
      ]
    }
  ],
  "summary": "정답 정책에 따라 상태와 초안 조건을 구분했습니다."
}